category,name,file_path,image_urls
None,a table with a vase of flowers on top of it,None/a table with a vase of flowers on top of it.jpg,https://images.unsplash.com/photo-1704973836219-4c9414787505?q=80&w=1000&auto=format&fit=crop&ixlib=rb-4.0.3&ixid=M3wxMjA3fDB8MHxwaG90by1wYWdlfHx8fGVufDB8fHx8fA%3D%3D
None,a man holding a violin in front of a window,None/a man holding a violin in front of a window.jpg,https://plus.unsplash.com/premium_photo-1703617663829-ac7430988118?q=80&w=1000&auto=format&fit=crop&ixlib=rb-4.0.3&ixid=M3wxMjA3fDB8MHxwaG90by1wYWdlfHx8fGVufDB8fHx8fA%3D%3D
Street Photography,a man sitting on a bench in front of a building,Street Photography/a man sitting on a bench in front of a building.jpg,https://images.unsplash.com/photo-1701642127676-6b02986c969f?q=80&w=1000&auto=format&fit=crop&ixlib=rb-4.0.3&ixid=M3wxMjA3fDB8MHxwaG90by1wYWdlfHx8fGVufDB8fHx8fA%3D%3D
None,a man in a space suit with a skull on his back,None/a man in a space suit with a skull on his back.jpg,https://plus.unsplash.com/premium_photo-1705294359679-0c3e99b54465?q=80&w=1000&auto=format&fit=crop&ixlib=rb-4.0.3&ixid=M3wxMjA3fDB8MHxwaG90by1wYWdlfHx8fGVufDB8fHx8fA%3D%3D
Spirituality,a mountain range covered in snow at sunset,Spirituality/a mountain range covered in snow at sunset.jpg,https://images.unsplash.com/photo-1704741252008-bc9930d84a0a?q=80&w=1000&auto=format&fit=crop&ixlib=rb-4.0.3&ixid=M3wxMjA3fDB8MHxwaG90by1wYWdlfHx8fGVufDB8fHx8fA%3D%3D
None,a bunch of bubbles floating in the air,None/a bunch of bubbles floating in the air.jpg,https://plus.unsplash.com/premium_photo-1664037234905-fef616c63fde?q=80&w=1000&auto=format&fit=crop&ixlib=rb-4.0.3&ixid=M3wxMjA3fDB8MHxwaG90by1wYWdlfHx8fGVufDB8fHx8fA%3D%3D
Spirituality,a mountain covered in lots of trees next to a forest,Spirituality/a mountain covered in lots of trees next to a forest.jpg,https://images.unsplash.com/photo-1704827260733-5569f0432250?q=80&w=1000&auto=format&fit=crop&ixlib=rb-4.0.3&ixid=M3wxMjA3fDB8MHxwaG90by1wYWdlfHx8fGVufDB8fHx8fA%3D%3D
Food & Drink,three slices of orange sitting on top of a blue surface,Food & Drink/three slices of orange sitting on top of a blue surface.jpg,https://images.unsplash.com/photo-1703956888956-9694d4c408b4?q=80&w=1000&auto=format&fit=crop&ixlib=rb-4.0.3&ixid=M3wxMjA3fDB8MHxwaG90by1wYWdlfHx8fGVufDB8fHx8fA%3D%3D
Fashion & Beauty,a man with no shirt on posing for a picture,Fashion & Beauty/a man with no shirt on posing for a picture.jpg,https://images.unsplash.com/photo-1695146738484-396a452d88d5?q=80&w=1000&auto=format&fit=crop&ixlib=rb-4.0.3&ixid=M3wxMjA3fDB8MHxwaG90by1wYWdlfHx8fGVufDB8fHx8fA%3D%3D
Health & Wellness,man in gray long sleeve shirt holding black smartphone,Health & Wellness/man in gray long sleeve shirt holding black smartphone.jpg,https://images.unsplash.com/photo-1617143777034-fe4c261ac738?q=80&w=1000&auto=format&fit=crop&ixlib=rb-4.0.3&ixid=M3wxMjA3fDB8MHxwaG90by1wYWdlfHx8fGVufDB8fHx8fA%3D%3D
Street Photography,a very tall tower with a crane on top of it,Street Photography/a very tall tower with a crane on top of it.jpg,https://images.unsplash.com/photo-1704993236743-a329685e3049?q=80&w=1000&auto=format&fit=crop&ixlib=rb-4.0.3&ixid=M3wxMjA3fDB8MHxwaG90by1wYWdlfHx8fGVufDB8fHx8fA%3D%3D
None,a snow covered mountain with a road going through it,None/a snow covered mountain with a road going through it.jpg,https://plus.unsplash.com/premium_photo-1705335965034-ebf6ab4ca928?q=80&w=1000&auto=format&fit=crop&ixlib=rb-4.0.3&ixid=M3wxMjA3fDB8MHxwaG90by1wYWdlfHx8fGVufDB8fHx8fA%3D%3D
None,a close up of a bunch of candy hearts,None/a close up of a bunch of candy hearts.jpg,https://plus.unsplash.com/premium_photo-1670856377657-163942a0352a?q=80&w=1000&auto=format&fit=crop&ixlib=rb-4.0.3&ixid=M3wxMjA3fDB8MHxwaG90by1wYWdlfHx8fGVufDB8fHx8fA%3D%3D
Food & Drink,clear drinking glass with red liquid,Food & Drink/clear drinking glass with red liquid.jpg,https://images.unsplash.com/photo-1618924385085-aa725b876250?q=80&w=1000&auto=format&fit=crop&ixlib=rb-4.0.3&ixid=M3wxMjA3fDB8MHxwaG90by1wYWdlfHx8fGVufDB8fHx8fA%3D%3D
None,a living room with a chair and a table,None/a living room with a chair and a table.jpg,https://plus.unsplash.com/premium_photo-1705262413765-5fe7a310d4e6?q=80&w=1000&auto=format&fit=crop&ixlib=rb-4.0.3&ixid=M3wxMjA3fDB8MHxwaG90by1wYWdlfHx8fGVufDB8fHx8fA%3D%3D
None,a vase sitting on a table next to a picture frame,None/a vase sitting on a table next to a picture frame.jpg,https://plus.unsplash.com/premium_photo-1681412205404-e4a7c9b21824?q=80&w=1000&auto=format&fit=crop&ixlib=rb-4.0.3&ixid=M3wxMjA3fDB8MHxwaG90by1wYWdlfHx8fGVufDB8fHx8fA%3D%3D
Architecture & Interiors,a living room filled with furniture and a staircase,Architecture & Interiors/a living room filled with furniture and a staircase.jpg,https://images.unsplash.com/photo-1704973982149-6729c94f10ce?q=80&w=1000&auto=format&fit=crop&ixlib=rb-4.0.3&ixid=M3wxMjA3fDB8MHxwaG90by1wYWdlfHx8fGVufDB8fHx8fA%3D%3D
Health & Wellness,a black chair sitting on top of a wooden deck,Health & Wellness/a black chair sitting on top of a wooden deck.jpg,https://images.unsplash.com/photo-1703783028657-5905a1662aa8?q=80&w=1000&auto=format&fit=crop&ixlib=rb-4.0.3&ixid=M3wxMjA3fDB8MHxwaG90by1wYWdlfHx8fGVufDB8fHx8fA%3D%3D
Spirituality,a plane flying through a cloudy sky at sunset,Spirituality/a plane flying through a cloudy sky at sunset.jpg,https://images.unsplash.com/photo-1698428282199-76d1757fddf2?q=80&w=1000&auto=format&fit=crop&ixlib=rb-4.0.3&ixid=M3wxMjA3fDB8MHxwaG90by1wYWdlfHx8fGVufDB8fHx8fA%3D%3D
Animals,a close up of a bird with a blurry background,Animals/a close up of a bird with a blurry background.jpg,https://images.unsplash.com/photo-1704875940244-299752f81346?q=80&w=1000&auto=format&fit=crop&ixlib=rb-4.0.3&ixid=M3wxMjA3fDB8MHxwaG90by1wYWdlfHx8fGVufDB8fHx8fA%3D%3D
Street Photography,a couple of women walking down a street next to a dog,Street Photography/a couple of women walking down a street next to a dog.jpg,https://images.unsplash.com/photo-1705245637075-5709df5bd67b?q=80&w=1000&auto=format&fit=crop&ixlib=rb-4.0.3&ixid=M3wxMjA3fDB8MHxwaG90by1wYWdlfHx8fGVufDB8fHx8fA%3D%3D
Health & Wellness,person pouring liquid to mug,Health & Wellness/person pouring liquid to mug.jpg,https://images.unsplash.com/photo-1563729527709-d5ebaae57efa?q=80&w=1000&auto=format&fit=crop&ixlib=rb-4.0.3&ixid=M3wxMjA3fDB8MHxwaG90by1wYWdlfHx8fGVufDB8fHx8fA%3D%3D
Travel,white and red airplane in mid air,Travel/white and red airplane in mid air.jpg,https://images.unsplash.com/photo-1602615466687-7f53b6c315cc?q=80&w=1000&auto=format&fit=crop&ixlib=rb-4.0.3&ixid=M3wxMjA3fDB8MHxwaG90by1wYWdlfHx8fGVufDB8fHx8fA%3D%3D
Nature,a bird sitting on top of a tree branch,Nature/a bird sitting on top of a tree branch.jpg,https://images.unsplash.com/photo-1704269509957-687ec09cc1ad?q=80&w=1000&auto=format&fit=crop&ixlib=rb-4.0.3&ixid=M3wxMjA3fDB8MHxwaG90by1wYWdlfHx8fGVufDB8fHx8fA%3D%3D
Food & Drink,a hand holding a drink in a pool,Food & Drink/a hand holding a drink in a pool.jpg,https://images.unsplash.com/photo-1698332329147-75458d640f28?q=80&w=1000&auto=format&fit=crop&ixlib=rb-4.0.3&ixid=M3wxMjA3fDB8MHxwaG90by1wYWdlfHx8fGVufDB8fHx8fA%3D%3D
None,a couple of large wooden doors in front of a building,None/a couple of large wooden doors in front of a building.jpg,https://plus.unsplash.com/premium_photo-1705004597770-40e4db5df8a6?q=80&w=1000&auto=format&fit=crop&ixlib=rb-4.0.3&ixid=M3wxMjA3fDB8MHxwaG90by1wYWdlfHx8fGVufDB8fHx8fA%3D%3D
Architecture & Interiors,a blue and white design,Architecture & Interiors/a blue and white design.jpg,https://images.unsplash.com/photo-1667994898240-cee111f6692c?q=80&w=1000&auto=format&fit=crop&ixlib=rb-4.0.3&ixid=M3wxMjA3fDB8MHxwaG90by1wYWdlfHx8fGVufDB8fHx8fA%3D%3D
Wallpapers,a snow covered mountain with clouds in the foreground,Wallpapers/a snow covered mountain with clouds in the foreground.jpg,https://images.unsplash.com/photo-1704821396617-14fa24f8a24d?q=80&w=1000&auto=format&fit=crop&ixlib=rb-4.0.3&ixid=M3wxMjA3fDB8MHxwaG90by1wYWdlfHx8fGVufDB8fHx8fA%3D%3D
Nature,an aerial view of a body of water,Nature/an aerial view of a body of water.jpg,https://images.unsplash.com/photo-1705133847476-d05dc384e2bf?q=80&w=1000&auto=format&fit=crop&ixlib=rb-4.0.3&ixid=M3wxMjA3fDB8MHxwaG90by1wYWdlfHx8fGVufDB8fHx8fA%3D%3D
Experimental,a blue window on a yellow wall with a shadow of a palm tree,Experimental/a blue window on a yellow wall with a shadow of a palm tree.jpg,https://images.unsplash.com/photo-1689265908452-4a1ee2dc366f?q=80&w=1000&auto=format&fit=crop&ixlib=rb-4.0.3&ixid=M3wxMjA3fDB8MHxwaG90by1wYWdlfHx8fGVufDB8fHx8fA%3D%3D
Arts & Culture,a woman in a kimono holding a bouquet of flowers,Arts & Culture/a woman in a kimono holding a bouquet of flowers.jpg,https://images.unsplash.com/photo-1704740413900-580c5c494711?q=80&w=1000&auto=format&fit=crop&ixlib=rb-4.0.3&ixid=M3wxMjA3fDB8MHxwaG90by1wYWdlfHx8fGVufDB8fHx8fA%3D%3D
Architecture & Interiors,a very tall building with a lot of windows,Architecture & Interiors/a very tall building with a lot of windows.jpg,https://images.unsplash.com/photo-1704569201769-17fd0f139a9b?q=80&w=1000&auto=format&fit=crop&ixlib=rb-4.0.3&ixid=M3wxMjA3fDB8MHxwaG90by1wYWdlfHx8fGVufDB8fHx8fA%3D%3D
Spirituality,a cup of coffee and a book on a table,Spirituality/a cup of coffee and a book on a table.jpg,https://images.unsplash.com/photo-1673346061852-a8f19719d0d6?q=80&w=1000&auto=format&fit=crop&ixlib=rb-4.0.3&ixid=M3wxMjA3fDB8MHxwaG90by1wYWdlfHx8fGVufDB8fHx8fA%3D%3D
Architecture & Interiors,white and gray sofa chair near glass window,Architecture & Interiors/white and gray sofa chair near glass window.jpg,https://images.unsplash.com/photo-1600488999140-f5bb6339fd09?q=80&w=1000&auto=format&fit=crop&ixlib=rb-4.0.3&ixid=M3wxMjA3fDB8MHxwaG90by1wYWdlfHx8fGVufDB8fHx8fA%3D%3D
Health & Wellness,person holding gray metal tool,Health & Wellness/person holding gray metal tool.jpg,https://images.unsplash.com/photo-1629261651616-00c3e07ca6e8?q=80&w=1000&auto=format&fit=crop&ixlib=rb-4.0.3&ixid=M3wxMjA3fDB8MHxwaG90by1wYWdlfHx8fGVufDB8fHx8fA%3D%3D
Food & Drink,a bowl of gummy bears sitting on top of a wooden table,Food & Drink/a bowl of gummy bears sitting on top of a wooden table.jpg,https://images.unsplash.com/photo-1705312435272-2778395ce362?q=80&w=1000&auto=format&fit=crop&ixlib=rb-4.0.3&ixid=M3wxMjA3fDB8MHxwaG90by1wYWdlfHx8fGVufDB8fHx8fA%3D%3D
Animals,a small bird perched on a tree branch,Animals/a small bird perched on a tree branch.jpg,https://images.unsplash.com/photo-1704960465767-72712de3e4d0?q=80&w=1000&auto=format&fit=crop&ixlib=rb-4.0.3&ixid=M3wxMjA3fDB8MHxwaG90by1wYWdlfHx8fGVufDB8fHx8fA%3D%3D
People,man doing a cross hand sign with his arms,People/man doing a cross hand sign with his arms.jpg,https://images.unsplash.com/photo-1542849988-cb971c949613?q=80&w=1000&auto=format&fit=crop&ixlib=rb-4.0.3&ixid=M3wxMjA3fDB8MHxwaG90by1wYWdlfHx8fGVufDB8fHx8fA%3D%3D
Street Photography,,Street Photography/None.jpg,https://images.unsplash.com/photo-1704928116641-359482d8563d?q=80&w=1000&auto=format&fit=crop&ixlib=rb-4.0.3&ixid=M3wxMjA3fDB8MHxwaG90by1wYWdlfHx8fGVufDB8fHx8fA%3D%3D
Experimental,a person standing on top of a mountain holding an umbrella,Experimental/a person standing on top of a mountain holding an umbrella.jpg,https://images.unsplash.com/photo-1705256978713-d51de443130d?q=80&w=1000&auto=format&fit=crop&ixlib=rb-4.0.3&ixid=M3wxMjA3fDB8MHxwaG90by1wYWdlfHx8fGVufDB8fHx8fA%3D%3D
Travel,a couple of tall buildings,Travel/a couple of tall buildings.jpg,https://images.unsplash.com/photo-1665056507555-7104246b2f95?q=80&w=1000&auto=format&fit=crop&ixlib=rb-4.0.3&ixid=M3wxMjA3fDB8MHxwaG90by1wYWdlfHx8fGVufDB8fHx8fA%3D%3D
Travel,an aerial view of a carnival at night,Travel/an aerial view of a carnival at night.jpg,https://images.unsplash.com/photo-1704497937233-0cb4f5f6cd18?q=80&w=1000&auto=format&fit=crop&ixlib=rb-4.0.3&ixid=M3wxMjA3fDB8MHxwaG90by1wYWdlfHx8fGVufDB8fHx8fA%3D%3D
Health & Wellness,green and white flower buds on white paper,Health & Wellness/green and white flower buds on white paper.jpg,https://images.unsplash.com/photo-1612978364356-131a7d4fa32e?q=80&w=1000&auto=format&fit=crop&ixlib=rb-4.0.3&ixid=M3wxMjA3fDB8MHxwaG90by1wYWdlfHx8fGVufDB8fHx8fA%3D%3D
Food & Drink,a person holding a cup of coffee with a toothbrush in it,Food & Drink/a person holding a cup of coffee with a toothbrush in it.jpg,https://images.unsplash.com/photo-1705229575068-7dda3c929d22?q=80&w=1000&auto=format&fit=crop&ixlib=rb-4.0.3&ixid=M3wxMjA3fDB8MHxwaG90by1wYWdlfHx8fGVufDB8fHx8fA%3D%3D
3D Renders,a couple of people that are standing in the dark,3D Renders/a couple of people that are standing in the dark.jpg,https://images.unsplash.com/photo-1704869881379-4e88e66c0248?q=80&w=1000&auto=format&fit=crop&ixlib=rb-4.0.3&ixid=M3wxMjA3fDB8MHxwaG90by1wYWdlfHx8fGVufDB8fHx8fA%3D%3D
None,a small house in the middle of a forest,None/a small house in the middle of a forest.jpg,https://plus.unsplash.com/premium_photo-1663946448065-967d72d58b4f?q=80&w=1000&auto=format&fit=crop&ixlib=rb-4.0.3&ixid=M3wxMjA3fDB8MHxwaG90by1wYWdlfHx8fGVufDB8fHx8fA%3D%3D
Spirituality,a very tall building with a clock on it's side,Spirituality/a very tall building with a clock on it's side.jpg,https://images.unsplash.com/photo-1704576343532-f50e38a6af52?q=80&w=1000&auto=format&fit=crop&ixlib=rb-4.0.3&ixid=M3wxMjA3fDB8MHxwaG90by1wYWdlfHx8fGVufDB8fHx8fA%3D%3D
None,a group of young people standing next to each other,None/a group of young people standing next to each other.jpg,https://plus.unsplash.com/premium_photo-1700801904528-d497a06cf54e?q=80&w=1000&auto=format&fit=crop&ixlib=rb-4.0.3&ixid=M3wxMjA3fDB8MHxwaG90by1wYWdlfHx8fGVufDB8fHx8fA%3D%3D
Nature,a snow covered forest filled with lots of trees,Nature/a snow covered forest filled with lots of trees.jpg,https://images.unsplash.com/photo-1704774801286-c06af794df06?q=80&w=1000&auto=format&fit=crop&ixlib=rb-4.0.3&ixid=M3wxMjA3fDB8MHxwaG90by1wYWdlfHx8fGVufDB8fHx8fA%3D%3D
Film,a basketball hoop hanging from the side of a house,Film/a basketball hoop hanging from the side of a house.jpg,https://images.unsplash.com/photo-1705018637417-f7aad7e893bd?q=80&w=1000&auto=format&fit=crop&ixlib=rb-4.0.3&ixid=M3wxMjA3fDB8MHxwaG90by1wYWdlfHx8fGVufDB8fHx8fA%3D%3D
Travel,a ferris wheel lit up against a black background,Travel/a ferris wheel lit up against a black background.jpg,https://images.unsplash.com/photo-1704993236948-5d11674f76eb?q=80&w=1000&auto=format&fit=crop&ixlib=rb-4.0.3&ixid=M3wxMjA3fDB8MHxwaG90by1wYWdlfHx8fGVufDB8fHx8fA%3D%3D
Animals,a small white dog standing in the snow,Animals/a small white dog standing in the snow.jpg,https://images.unsplash.com/photo-1705179910388-0dfc2c21a3f9?q=80&w=1000&auto=format&fit=crop&ixlib=rb-4.0.3&ixid=M3wxMjA3fDB8MHxwaG90by1wYWdlfHx8fGVufDB8fHx8fA%3D%3D
Architecture & Interiors,"a kitchen with a table, chairs, and a bar","Architecture & Interiors/a kitchen with a table, chairs, and a bar.jpg",https://images.unsplash.com/photo-1704974025832-e5b3299a1cec?q=80&w=1000&auto=format&fit=crop&ixlib=rb-4.0.3&ixid=M3wxMjA3fDB8MHxwaG90by1wYWdlfHx8fGVufDB8fHx8fA%3D%3D
Minimalism,a close up view of a wavy white surface,Minimalism/a close up view of a wavy white surface.jpg,https://images.unsplash.com/photo-1705097565168-fb30476501e5?q=80&w=1000&auto=format&fit=crop&ixlib=rb-4.0.3&ixid=M3wxMjA3fDB8MHxwaG90by1wYWdlfHx8fGVufDB8fHx8fA%3D%3D
Fashion & Beauty,a man standing in a dark room with a red light on his face,Fashion & Beauty/a man standing in a dark room with a red light on his face.jpg,https://images.unsplash.com/photo-1692839929461-b3b30e36ef70?q=80&w=1000&auto=format&fit=crop&ixlib=rb-4.0.3&ixid=M3wxMjA3fDB8MHxwaG90by1wYWdlfHx8fGVufDB8fHx8fA%3D%3D
Health & Wellness,assorted-color of fruits and vegetables,Health & Wellness/assorted-color of fruits and vegetables.jpg,https://images.unsplash.com/photo-1556559214-9d7db920d2eb?q=80&w=1000&auto=format&fit=crop&ixlib=rb-4.0.3&ixid=M3wxMjA3fDB8MHxwaG90by1wYWdlfHx8fGVufDB8fHx8fA%3D%3D
3D Renders,a white x-ray of a person's face,3D Renders/a white x-ray of a person's face.jpg,https://images.unsplash.com/photo-1650784724193-245ec30c21be?q=80&w=1000&auto=format&fit=crop&ixlib=rb-4.0.3&ixid=M3wxMjA3fDB8MHxwaG90by1wYWdlfHx8fGVufDB8fHx8fA%3D%3D
Experimental,a woman holding two slices of limes over her eyes,Experimental/a woman holding two slices of limes over her eyes.jpg,https://images.unsplash.com/photo-1688079376805-ca1d772f8579?q=80&w=1000&auto=format&fit=crop&ixlib=rb-4.0.3&ixid=M3wxMjA3fDB8MHxwaG90by1wYWdlfHx8fGVufDB8fHx8fA%3D%3D
Street Photography,a shadow of a person on a wall,Street Photography/a shadow of a person on a wall.jpg,https://images.unsplash.com/photo-1704368705120-9d76163ecc40?q=80&w=1000&auto=format&fit=crop&ixlib=rb-4.0.3&ixid=M3wxMjA3fDB8MHxwaG90by1wYWdlfHx8fGVufDB8fHx8fA%3D%3D
Architecture & Interiors,a walkway leading to a white triangular structure on a beach,Architecture & Interiors/a walkway leading to a white triangular structure on a beach.jpg,https://images.unsplash.com/photo-1705449589011-58b69afb110c?q=80&w=1000&auto=format&fit=crop&ixlib=rb-4.0.3&ixid=M3wxMjA3fDB8MHxwaG90by1wYWdlfHx8fGVufDB8fHx8fA%3D%3D
Spirituality,a mountain range covered in snow under a blue sky,Spirituality/a mountain range covered in snow under a blue sky.jpg,https://images.unsplash.com/photo-1705085496539-b515c38104c2?q=80&w=1000&auto=format&fit=crop&ixlib=rb-4.0.3&ixid=M3wxMjA3fDB8MHxwaG90by1wYWdlfHx8fGVufDB8fHx8fA%3D%3D
Film,a fern is growing in the middle of a forest,Film/a fern is growing in the middle of a forest.jpg,https://images.unsplash.com/photo-1705018322169-87a72a61dfb4?q=80&w=1000&auto=format&fit=crop&ixlib=rb-4.0.3&ixid=M3wxMjA3fDB8MHxwaG90by1wYWdlfHx8fGVufDB8fHx8fA%3D%3D
